{
	"$schema": "https://json-schema.org/draft/2020-12/schema",
	"$id": "https://raw.githubusercontent.com/0u73r-h34v3n/opengamesdatabase/refs/heads/master/shared/metadata_schema.json",
	"title": "Open Games Database - Metadata Schema",
	"description": "JSON Schema for video game metadata in the Open Games Database",
	"type": "object",
	"properties": {
		"$schema": {
			"type": "string",
			"description": "Reference to this JSON Schema"
		},
		"acronyms": {
			"type": "array",
			"description": "Common acronyms or abbreviations for the game title",
			"items": {
				"type": "string",
				"minLength": 1,
				"pattern": "^[A-Z0-9][A-Z0-9 :&'-]*$"
			},
			"uniqueItems": true,
			"minItems": 1
		},
		"aliases": {
			"type": "array",
			"description": "Alternative names or titles for the game (including localized titles)",
			"items": {
				"type": "string",
				"minLength": 1
			},
			"uniqueItems": true,
			"minItems": 1
		},
		"developers": {
			"type": "array",
			"description": "Companies or individuals who developed the game",
			"items": {
				"type": "string",
				"minLength": 1
			},
			"uniqueItems": true,
			"minItems": 1
		},
		"franchise": {
			"type": "string",
			"description": "The franchise or series this game belongs to",
			"minLength": 1
		},
		"genres": {
			"type": "array",
			"description": "Game genres and categories",
			"items": {
				"type": "string",
				"minLength": 1
			},
			"uniqueItems": true,
			"minItems": 1
		},
		"locales": {
			"type": "array",
			"items": {
				"anyOf": [
					{
						"const": "EN",
						"description": "English"
					},
					{
						"const": "DE",
						"description": "German"
					},
					{
						"const": "ES",
						"description": "Spanish"
					},
					{
						"const": "FR",
						"description": "French"
					},
					{
						"const": "IT",
						"description": "Italian"
					},
					{
						"const": "JA",
						"description": "Japanese"
					},
					{
						"const": "KO",
						"description": "Korean"
					},
					{
						"const": "PL",
						"description": "Polish"
					},
					{
						"const": "PT",
						"description": "Portuguese"
					},
					{
						"const": "RU",
						"description": "Russian"
					},
					{
						"const": "UK",
						"description": "Ukrainian"
					},
					{
						"const": "ZH",
						"description": "Chinese"
					},
					{
						"const": "ZH-CN",
						"description": "Chinese (Simplified)"
					},
					{
						"const": "ZH-TW",
						"description": "Chinese (Traditional)"
					},
					{
						"const": "NL",
						"description": "Dutch"
					},
					{
						"const": "SV",
						"description": "Swedish"
					},
					{
						"const": "DA",
						"description": "Danish"
					},
					{
						"const": "FI",
						"description": "Finnish"
					},
					{
						"const": "NO",
						"description": "Norwegian"
					},
					{
						"const": "AR",
						"description": "Arabic"
					},
					{
						"const": "TR",
						"description": "Turkish"
					},
					{
						"const": "CS",
						"description": "Czech"
					},
					{
						"const": "HU",
						"description": "Hungarian"
					},
					{
						"const": "EL",
						"description": "Greek"
					}
				]
			}
		},
		"name": {
			"type": "string",
			"description": "Official title of the game",
			"minLength": 1,
			"maxLength": 200
		},
		"publishers": {
			"type": "array",
			"description": "Companies that published or distributed the game",
			"items": {
				"type": "string",
				"minLength": 1
			},
			"uniqueItems": true,
			"minItems": 1
		},
		"ratings": {
			"type": "array",
			"description": "Age ratings and content ratings from various rating organizations",
			"items": {
				"type": "object",
				"properties": {
					"name": {
						"type": "string",
						"description": "The name of the rating organization or system (e.g., ESRB, PEGI, CERO)",
						"minLength": 1
					},
					"rating": {
						"type": "string",
						"description": "The rating value associated with the game (e.g., E10+, 12, B)",
						"minLength": 1
					}
				},
				"required": ["name", "rating"],
				"additionalProperties": false
			},
			"uniqueItems": true,
			"minItems": 1
		},
		"regions": {
			"type": "array",
			"items": {
				"anyOf": [
					{
						"const": "NTSC",
						"description": "NTSC: Was used in most of the Americas (except Argentina, Brazil, Paraguay, and Uruguay), Myanmar, South Korea, Taiwan, Philippines, Japan, and some Pacific Islands nations and territories"
					},
					{
						"const": "NTSC-U",
						"description": "NTSC-U: United States, Canada, Mexico (Standard NTSC for North America)"
					},
					{
						"const": "NTSC-J",
						"description": "NTSC-J: Japan (Specific NTSC for Japan with unique video specifications)"
					},
					{
						"const": "NTSC-K",
						"description": "NTSC-K: South Korea (NTSC format used in South Korea)"
					},
					{
						"const": "NTSC-M",
						"description": "NTSC-M: Central & South America, Caribbean (NTSC format used in these regions)"
					},
					{
						"const": "NTSC-T",
						"description": "NTSC-T: Taiwan (Specific NTSC version for Taiwan)"
					},
					{
						"const": "NTSC-C",
						"description": "NTSC-C: China (NTSC used in China)"
					},
					{
						"const": "NTSC-KO",
						"description": "NTSC-KO: North Korea (NTSC version for North Korea)"
					},
					{
						"const": "PAL",
						"description": "PAL: Was adopted by most European countries, by several African countries, by Argentina, Brazil, Paraguay, Uruguay, and by most of Asia Pacific (including the Middle East and South Asia)."
					},
					{
						"const": "PAL-B",
						"description": "PAL-B: Western Europe (France, Belgium, Netherlands, Spain)"
					},
					{
						"const": "PAL-D",
						"description": "PAL-D: Germany, Austria, Eastern Europe"
					},
					{
						"const": "PAL-G",
						"description": "PAL-G: Greece, Cyprus"
					},
					{
						"const": "PAL-H",
						"description": "PAL-H: India, Bangladesh, Sri Lanka, parts of Africa"
					},
					{
						"const": "PAL-I",
						"description": "PAL-I: United Kingdom, Ireland, Western Europe"
					},
					{
						"const": "PAL-M",
						"description": "PAL-M: Brazil (Unique PAL format for Brazil)"
					},
					{
						"const": "PAL-N",
						"description": "PAL-N: Argentina, Uruguay"
					},
					{
						"const": "PAL-NC",
						"description": "PAL-NC: Chile (A variant of PAL for Chile)"
					},
					{
						"const": "SECAM",
						"description": "SECAM: General SECAM format used for broadcasting in parts of Eastern Europe, Russia, and Africa"
					},
					{
						"const": "SECAM-D",
						"description": "SECAM-D: Eastern Europe (e.g., Bulgaria, Hungary)"
					},
					{
						"const": "SECAM-K",
						"description": "SECAM-K: Russia, Kazakhstan, parts of the former USSR"
					},
					{
						"const": "SECAM-L",
						"description": "SECAM-L: France (specific to mainland France)"
					},
					{
						"const": "SECAM-V",
						"description": "SECAM-V: Middle East (Iran, Iraq)"
					}
				]
			}
		},
		"release_date": {
			"type": "string",
			"pattern": "^(January|February|March|April|May|June|July|August|September|October|November|December) ([1-9]|[12][0-9]|3[01]), (19[0-9]{2}|20[0-9]{2}|21[0-9]{2})$",
			"description": "Game release date in format: 'Month Day, Year' (e.g., 'March 3, 2017')",
			"examples": ["March 3, 2017", "November 21, 1998", "January 1, 2020"]
		},
		"reviews": {
			"type": "array",
			"description": "Reviews and scores from gaming publications and websites",
			"items": {
				"type": "object",
				"properties": {
					"name": {
						"type": "string",
						"description": "The name of the review source or platform (e.g., IGN, Metacritic, GameSpot)",
						"minLength": 1
					},
					"url": {
						"type": "string",
						"format": "uri",
						"description": "The URL to the review or review platform",
						"pattern": "^https?://.+"
					},
					"score": {
						"type": "number",
						"minimum": 0,
						"description": "The score given by the review platform (normalized if max_score is provided)"
					},
					"max_score": {
						"type": "number",
						"minimum": 1,
						"description": "Maximum possible score for this review system (e.g., 5, 10, or 100)",
						"examples": [5, 10, 100]
					}
				},
				"required": ["name", "url", "score"],
				"additionalProperties": false
			},
			"uniqueItems": true,
			"minItems": 1
		},
		"serial_number": {
			"type": "string",
			"description": "Unique product identifier or serial code assigned to the game (e.g., SLUS-01234, CTR-P-ABCD)",
			"minLength": 1,
			"maxLength": 50,
			"pattern": "^[A-Z0-9][A-Z0-9-_ ]*$"
		},
		"synopsis": {
			"type": "string",
			"description": "Brief description of the game's story, gameplay, and main features",
			"minLength": 1,
			"maxLength": 2000
		}
	},
	"required": ["name"],
	"additionalProperties": false
}
