{
	"$schema": "https://raw.githubusercontent.com/0u73r-h34v3n/opengamesdatabase/refs/heads/master/shared/metadata_schema.json",
	"developers": ["Square Enix"],
	"genres": ["Collection"],
	"name": "Kingdom Hearts: Trinity Master Pieces",
	"publishers": ["Square Enix"],
	"regions": ["NTSC-J"],
	"synopsis": "{{Collection| Japanese editions of [[Kingdom Hearts]], [[Kingdom Hearts II]] and ''Kingdom Hearts: Chain of Memories'' for GBA.}}"
}
