{
	"$schema": "https://raw.githubusercontent.com/0u73r-h34v3n/opengamesdatabase/refs/heads/master/shared/metadata_schema.json",
	"developers": ["Google"],
	"genres": ["Multimedia", "Software"],
	"name": "YouTube",
	"publishers": ["Nintendo"],
	"ratings": [
		{
			"name": "PEGI",
			"rating": "12"
		}
	],
	"release_date": "November 29, 2013",
	"serial_number": "JYTP",
	"synopsis": "Discover shows from channels like Disney, official music videos, and the latest trending videos. Sign in to your YouTube account to get caught up on all your subscriptions and watch your saved playlists."
}
