{
	"$schema": "https://raw.githubusercontent.com/0u73r-h34v3n/opengamesdatabase/refs/heads/master/shared/metadata_scheme.json",
	"developers": ["Princess Soft"],
	"genres": ["Visual Novel"],
	"name": "Natsuiro Komachi",
	"publishers": ["Princess Soft"],
	"regions": ["NTSC-J"],
	"synopsis": "You play as a key player in your school's swim club. Your two childhood friends are part of the archery club, and your sister-in-law is trying her best to swim as well as you. You and your friends are considered the best of your small town, but during this certain summer you begun receiving national attention. A TV news report has made feature on one of your archery friend's recent slew of victories. Now you are becoming notorious through her celebrity as well. You all begin training like crazy, and you soon discover the hidden feelings you have with the women around you. How will everyone put up with this sudden rise to fame?"
}
