{
	"$schema": "https://raw.githubusercontent.com/0u73r-h34v3n/opengamesdatabase/refs/heads/master/shared/metadata_schema.json",
	"locales": ["DE", "ES", "FR", "IT", "NL", "PT"],
	"name": "Squarcat",
	"publishers": ["RandomSpin Games"],
	"release_date": "September 5, 2019",
	"serial_number": "LSTP",
	"synopsis": "High in the sky, mysterious lands hover. There lives a Squarecat and adventure begin here! Your task is to reach the finish line by solving different puzzles. -The game is expanded on two screens. -Cute, simple graphics. -The game has a soothing atmosphere."
}
