{
	"$schema": "https://raw.githubusercontent.com/0u73r-h34v3n/opengamesdatabase/refs/heads/master/shared/metadata_scheme.json",
	"developers": ["The Code Monkeys"],
	"genres": ["Family", "Puzzle"],
	"name": "Dinosaur Adventure",
	"publishers": ["Phoenix Games"],
	"regions": ["PAL"],
	"synopsis": "The disk contains a short, animated movie about a young dinosaur named Tio who gets separated from his family and goes out searching for them."
}
