{
	"$schema": "https://raw.githubusercontent.com/0u73r-h34v3n/opengamesdatabase/refs/heads/master/shared/metadata_scheme.json",
	"developers": ["Takuyo"],
	"genres": ["Visual Novel"],
	"name": "E'tude Prologue: Yureugoku Kokoro no Katachi",
	"publishers": ["Takuyo"],
	"regions": ["NTSC-J"],
	"synopsis": "A coastal town called \"South Aose\" surrounded by the sea and mountains is a place where lots of nature still remains. Two normal high school students go to a school in this town. The story starts in the special winter of the 3rd year of school when these two protagonists meet."
}
