{
	"$schema": "https://raw.githubusercontent.com/0u73r-h34v3n/opengamesdatabase/refs/heads/master/shared/metadata_schema.json",
	"locales": ["DE", "FR", "IT", "NL"],
	"name": "LEGO Batman 3 - Au-del√° de Gotham",
	"publishers": ["WB Games"],
	"release_date": "November 14, 2014",
	"serial_number": "BTMY"
}
